score,title,likereview,dislikereview,country,rometype,intimelong,people,inrometime,reviewtime,help_vote,unhelp_vote
8.0,Great hotel in a perfect location,The room was very nice ! Couldnt hear noise from the street when the windows are closed. Very nice bathroom. The location is perfect !,Nothing special !,South Africa,Premier Double Room,1 night ·,Solo traveller,July 2021,26 July 2021,,
8.0,Brilliant Location,"It was ideal for access to Covent Garden, Piccadilly and Leicester Square. The hotel was clean and comfortable and the staff were lovely and really helpful if you needed anything.","It’s not quite as luxurious as it describes and the little extras that you think your getting during your stay were not there. Even though Covid restrictions had been lifted the restaurant is still closed so no hot food available and the continental breakfast tray delivered to your room wasn’t brilliant, this really let them down.",United Kingdom,Premier Twin Room,2 nights ·,Family,July 2021,25 July 2021,,
9.0,Anniversary stay in London,"The hotel was very clean, the location was perfect and staff were so friendly and helpful.",Unfortunately the breakfast was provided in our room due to Covid and the toast was cold and there was limited choice,United Kingdom,Premier Double Room,1 night ·,Couple,July 2021,25 July 2021,,
8.0,Very nice,Got room upgraded and staff did special requests,,United Kingdom,Premier Double Room,1 night ·,Couple,July 2021,24 July 2021,,
7.0,THEATRE TRIP,"Staff were very welcoming.Location was great, central to everything.",All was great in current circumstances.,United Kingdom,Premier Twin Room,2 nights ·,Family,June 2021,24 July 2021,,
8.0,"Great hotel, very comfy and clean, amazing location.","Very clean, very comfortable, friendly helpful staff, beautiful hotel and decor. Fantastic location.","Due to Covid restrictions Breakfast was only available in the room, there wasn’t much selection provided, no plates provided for the toast, cereal was expected to be eaten from a plastic take away box with lid! Not what I expected from a high quality hotel as stayed in previously.We stayed at this hotel previously and had a huge corner room. Even though I didn’t expect this size room again we were in room 410 which was very small &amp; the bathroom tiny. No mini bar!",United Kingdom,Premier Double Room,1 night ·,Family,July 2021,23 July 2021,,
8.0,Very good,Great room. Brilliant location.,But noisy but it is the West End and I brought ear plugs.,United Kingdom,Premier Single Room,1 night ·,Solo traveller,July 2021,23 July 2021,,
7.0,Good,The room was excellent and staff friendly.,They haven't opened up yet the restaurant so breakfast which I had included was delivered to room and it was rubbish. Poor that even after July 19th they can't give you a cooked breakfast so 2nd morning I went out and got one. If everything opening up they have to have their facilities available in full so felt that I was ripped off.,United Kingdom,Club Double Room,2 nights ·,Solo traveller,July 2021,22 July 2021,,
8.0,Very good,Comfort,Wardrobe door broken,United Kingdom,Premier Twin Room,1 night ·,Family,July 2021,22 July 2021,,
8.0,Perfect location for a SoHo experience,The location was perfect for anyone wanting to experience SoHo. We had tickets for a couple of musicals so it was really nice to be near by the venue. It was a bit loud in the evening but that's to be expected when you're located in town.,The room smelled a bit musky and the bed sheets weren't as comfortable as other hotels for this price point.,Netherlands,Premier Twin Room,2 nights ·,Group,July 2021,21 July 2021,,
9.0,Mr E C,"Got upgraded to a better room, bit comfortable bed and clean! Nice interior to.",The breakfast was a bit meh but we didnt actually realise it was included in the room price so cannot complain.,United Kingdom,Premier Double Room,1 night ·,Group,July 2021,20 July 2021,,
8.0,Birthday Weekend,Couldn’t have found a better location in the centre of the West End. Very clean and the staff very friendly,"Due to Covid, the hotel restaurant and spa facilities were not available. So breakfast was served in our rooms, whilst it’s was nice, not the same as eating in a restaurant.",United Kingdom,Premier Double Room,2 nights ·,Group,July 2021,18 July 2021,,
8.0,Lovely stay in central london,Lovely boutique hotel right in the middle of everything. Room was very spacious and clean. Beds were comfy. No noise considering it was right in the middle of everything. Staff were very friendly,Breakfast was dissapointing,United Kingdom,Premier Twin Room,1 night ·,Group,July 2021,18 July 2021,,
9.0,"Would recommend, and will definitely come back and stay again.","Superb location, you couldn’t have had a better location!  Theatre, China town, Piccadilly Circus and regents street. Air conditioning in the room was wonderful as the temperature was soaring outside!  Lockdown hadn’t quite been lifted, so facilities like, bar and restaurant were still closed at the hotel.  Continental breakfast served in your room.  Staff were friendly and couldn’t have been more accommodating.  Nothing was too much trouble.","Due to circumstances beyond anyone’s control, facilities closed for Bar and restaurant.  No biggy , as you are only going there to sleep and shower.",United Kingdom,Premier Twin Room,2 nights ·,Group,July 2021,18 July 2021,,
9.0,Superb,Great location,A bit cramped,United Kingdom,Premier Single Room,1 night ·,Solo traveller,June 2021,18 July 2021,,
9.0,Superb,Proper single bed in our room for 3. No fold up sofa thank goodness! Polite and helpful staff. Bought us a hairdryer to the room straight away as we couldn't find one. Ironing board and iron to hand which was very useful.Great to check in at 2. A real bonus.,Continental breakfast bought to our room was good quality and plentiful thank you but there were no cereal bowls. Should have asked as the staff were so obliging.,United Kingdom,Junior Suite,1 night ·,Family,July 2021,17 July 2021,,
8.0,Great location,"The staff were very welcoming.  Location great for Ronnie Scott’s, China Town and Theatreland.  Room immaculately clean.  Staff accommodating in changing our room due to noise levels.","On first night we were on 1st floor room 115, it was really noisy and couldn’t sleep.  We asked for a room change and the 2nd night we were on the 4th floor and slept very well",United Kingdom,Premier Double Room,2 nights ·,Couple,July 2021,16 July 2021,,
7.0,"Lovely staff, good location","Location excellent for what we wanted, room ok little cramped but ok for 1 or 2 nights, breakfast ok had better but also had far worse.",Nothing really.,United Kingdom,Premier Double Room,1 night ·,Couple,June 2021,15 July 2021,,
7.0,Central London stay,"Location was spot on being on Shaftesbury Avenue, to theatre, Chinatown &amp; shopping.",Bathroom tiny compared to spacious room (Premier double).,United Kingdom,Premier Double Room,2 nights ·,Solo traveller,July 2021,15 July 2021,,
7.0,Good,Great location.Lovely accomodating staff.,"The room was very dated, it wasn't clean. We found a ladies top in the corner of the wardrobe!! There was no toilet roll in bathroom, very disappointed.",United Kingdom,Premier Double Room,2 nights ·,Couple,July 2021,14 July 2021,,
9.0,Busy night in London,Central location. Asked for room on high floor a got a great room high up and facing away from the noise (England match).,"Wasn’t expecting breakfast to be brought to the room. That said, it was very good for breakfast on a tray.",United Kingdom,Premier Double Room,1 night ·,Couple,July 2021,12 July 2021,,
9.0,"Superb location, lovely staff. Really enjoyed it.","Fantastic location at the heart of theatreland, between Chinatown and Soho. We were celebrating our wedding anniversary and were upgraded to a superior room with four poster bed and a complimentary 1/2 bottle of champagne. Very comfortable bed with quality bedding, big TV, nice shower room with fluffy towels. Although our room overlooked Shaftesbury Avenue the double glazing is very effective and we slept like babies. Due to Covid some facilities were not available, but we knew this before booking, and for the same reason breakfast was a continental version served to the room. I saw negative reviews of this hotel and can't understand them. Book with confidence.If you stay there, try the Brazilian Steak House on the corner (unless you are vegetarian, of course).",,United Kingdom,Premier Double Room,1 night ·,Couple,July 2021,11 July 2021,1,
8.0,Enjoyable,,Eating breakfast in my room,United Kingdom,Premier Single Room,1 night ·,Solo traveller,July 2021,11 July 2021,,
8.0,Very good,Clean accommodation.Staff friendly and helpful.,No evening meal available.Pillows hard and mattress wasn't that comfy either!,United Kingdom,Premier Single Room,2 nights ·,Solo traveller,July 2021,11 July 2021,,
9.0,Got a free upgrade,Friendly staff comfy room,Nothing really,United Kingdom,Premier Single Room,1 night ·,Solo traveller,July 2021,9 July 2021,,
8.0,All good.Thank you.,All good good value great location small rooms but clean and well presented. Staff very help full.Did not breakfast by choice,We new what we were getting and for the price we paid all was good. Would visit again.,United Kingdom,Premier Double Room,1 night ·,Couple,July 2021,8 July 2021,,
7.0,Good,Staff,"The bed I felt was not very comfortable but thats a personal preference, my partner liked it.",United Kingdom,Premier Double Room,2 nights ·,Couple,July 2021,7 July 2021,,
9.0,"Good overnight stay, perfect location","Amazing location, clean, friendly staff, easy check in","As it was so central, the outside noise was a little loud",Indonesia,Premier Double Room,1 night ·,Group,June 2021,7 July 2021,,
9.0,Superb,"Location, cleanliness,room.",Continental breakfast.,United Kingdom,Premier Twin Room,2 nights ·,Group,July 2021,6 July 2021,,
7.0,Good stay,Location is amazing. Great for theatre and Leicester Square etc. Walking distance to tube stations and regent street shopping etc.,Nothing,United Kingdom,Club Double Room,3 nights ·,Couple,July 2021,5 July 2021,,
8.0,Honeymoon bliss but breakfast nightmare,"Everything aside from the breakfast. The staff were amazing, welcoming and friendly. We arrived at 10:30pm and was told we have bubbles waiting in our room, and was given an upgrade to one of the best rooms there. The rooms were clean, the bath/shower was amazing, and elemis bathroom products 👍🏼","The breakfast was absolutely rubbish. Had an upgrade to full english (as it was a wedding night booking i.e. honeymoon suite) then were told in the morning (after we ordered room service) that there is no english breakfast for that day. The continental breakfast arrived on a tray and was two pieces of toast, 3 mini croissants (both in a paper bag and freezing cold), 2 yoghurts, 2 cereals, two teas, two juices. It didnt feel like a 5 star breakfast...I've had better from a travel lodge!",United Kingdom,Premier Double Room,1 night ·,Couple,July 2021,4 July 2021,,
8.0,Fantastic valve for money we will return,Fantastic breakfast exceeded our expectations.Fantastic location.,Nothing,United Kingdom,Premier Double Room,1 night ·,Couple,June 2021,3 July 2021,,
8.0,Very good,Great service,No spa open,United Kingdom,Premier Double Room,3 nights ·,Couple,June 2021,2 July 2021,,
8.0,"I will be back, happily",Location was superb and a very clean room,The room was quite compact but it was very good value for money,United Kingdom,Premier Double Room,1 night ·,Group,July 2021,2 July 2021,,
9.0,Superb,"Bed was comfortable, room was very spacious. Shower was excellent. Location was very good.",Only issue was the kettle in room 502 did not work.,United Kingdom,Premier Double Room,1 night ·,Couple,June 2021,1 July 2021,,
8.0,Very good,"Staff were great, and room comfortable .Great location.",No cooked breakfast due to covid space restrictions,United Kingdom,Premier Double Room,1 night ·,Couple,June 2021,29 June 2021,,
9.0,"Staff brilliant!, perfect location for theatres, Soho, and Chinatown",Location,"TV reception wasn’t the best, but was not there to watch telly!",United Kingdom,Premier Double Room,1 night ·,Couple,June 2021,27 June 2021,,
8.0,Expensive but paid that for the location. !,Good continental breakfast delivered to our roomGreat location,"Room was very small and a bit shabby , mould around unopening bathroom window .",United Kingdom,Premier Double Room,1 night ·,Couple,June 2021,27 June 2021,,
7.0,It was great. Very lovely staff the lady yesterday afternoon and the young man this morning checking out. Felt very welc,The staff and the hotel room.,N/A,United Kingdom,Premier Single Room,1 night ·,Solo traveller,June 2021,27 June 2021,,
8.0,24h fun filled night in London,"Excellent service, friendly staff, great room, great location",No real complaints really.,United Kingdom,Premier Double Room,1 night ·,Couple,June 2021,27 June 2021,,
8.0,Very good,"Excellent central location.The staff were very friendly, helpful and professional.The beds were extremely comfy.",Difficult to open nets to let in natural light.,United Kingdom,Premier Twin Room,1 night ·,Group,June 2021,27 June 2021,,
9.0,Perfect spot for Soho/Chinatown,"The staff were all very helpful and friendly, location was fantastic, with no noise in our room considering where we were. The price was unbeatable.","Everything was positive, even our very minor issue of having no batteries in the TV remote was dealt with very quickly.",United Kingdom,Premier Double Room,1 night ·,Couple,June 2021,27 June 2021,,
9.0,Aron great staff,"Room wasnt ready and aron upgraded the room, it made a huge difference considering it was our wedding anniversary",Fasciloties like spa. Pool. Sauna. Kitchen were closed and breakfast was takeaway continental breakfast delivered to your room,United Kingdom,Premier Double Room,1 night ·,Couple,June 2021,20 June 2021,,
9.0,Really good x,Continental breakfast adequate,Bed too hard,United Kingdom,Premier Single Room,1 night ·,Group,June 2021,19 June 2021,,
8.0,Nice,Location,Bed - it was very uncomfortable,United Kingdom,Premier Double Room,1 night ·,Couple,June 2021,16 June 2021,,
8.0,Very good,Stunning shower and bathroom in general.  Staff were extremely nice and accommodating.,Dusty top shelf in the wardrobe so had dusty clothes in the morning,United Kingdom,Premier Double Room,1 night ·,Solo traveller,June 2021,13 June 2021,,
8.0,Very good,Great hotel!! Good size room. Fantastic location!!,,United Kingdom,Premier Double Room,2 nights ·,Couple,June 2021,11 June 2021,,
8.0,"We have a great time, made our stay in London easy.","Excellent location, very clean rooms. unfortunately the Spa and Restaurant were closed but the service was lovely.","The lift can be a bit slow, shame they hadn't got the spa up and running, but understandable considering we are still in a pandemic.",United Kingdom,Premier Twin Room,2 nights ·,Family,June 2021,6 June 2021,,
7.0,"Fantastic location, could do with improving on service.",Fantastic location,"Spa not open but not informed when booking, breakfast served in room but wasn’t asked if vegetarian, 3x meat breakfasts delivered but unable to eat, plus no soya milk although asked a day in advance.",United Kingdom,Junior Suite,1 night ·,Family,June 2021,5 June 2021,,
8.0,Very good,Great staff and location,Bar &amp; restaurant closed because of COVID restrictions,United Kingdom,Premier Twin Room,3 nights ·,Group,May 2021,31 May 2021,,
8.0,Very central,Very cleanFriendly staffGreat comfy bed,Little noisy,United Kingdom,Premier Double Room,1 night ·,Couple,May 2021,31 May 2021,,
9.0,Superb,Very clean and comfortable!,"General maintenance, couple of items broken or wonky",United Kingdom,Premier Double Room,1 night ·,Couple,May 2021,31 May 2021,,
9.0,Superb,Beds were really comfy. Decorum was incredible. It’s small but just perfect for what we needed.,"This isn’t related to the property but needs to be addressed. Whilst checking in, we were notified the breakfast would not be open so food shall be served to our room. Perfect! But...our toast was cold. We were not served on time. I understand continental breakfast is not supposed to be spectacular but for what we payed for i expect my toast to be warm at the very least.",United Kingdom,Club Double Room,1 night ·,Couple,May 2021,30 May 2021,,
7.0,Good Overall stay,Nice rooms,I sent 2 messages to the hotel before arriving one in regards to a late check out one to ask if we could have a bottle of champagne in the room for my partners birthday i had no reply to either messaged again the day before we arrived still no reply,United Kingdom,Premier Double Room,1 night ·,Couple,May 2021,27 May 2021,,
7.0,Good location needs better signage,"Beds were comfortable, loads of luxuries in the bedroom including hair dryer, iron, slippers etc.","I booked a junior suite for £340 for me &amp; my two girl friends (should have been £420!) Was rather disappointed to see that the single bed was tucked behind a partition wall. Also, very disappointed in breakfast. Understand that during Covid it would be in our room, but the portions didn’t match the size of our party. For the price we paid, cold toast, 2 butters between 8 slices &amp; only one jam didn’t seem sufficient enough.",United Kingdom,Junior Suite,1 night ·,Group,May 2021,25 May 2021,,
8.0,Very Central.,"Perfect location for us. Right in the centre of London. comfortable bed, good shower.",,United Kingdom,Premier Double Room,1 night ·,Couple,May 2021,24 May 2021,,
8.0,Great hotel only let down by the breakfast,"The staff were really friendly, the location was perfect for us and the room/beds were extremely comfortable. We enjoyed our stay with you. Thank you.","The breakfast was disappointing. We ordered a normal and a vegan breakfast. They didn't have any vegan options, not even an alternative to butter, but we're very apologetic and provided extra fruit for me. The breakfast (even the normal one) was made of very cheap low quality items including a carton of orange juice made from concentrate with 35p advertised on it. I know that this may be post lockdown teething problems but more thought about the quality of the breakfast and accommodating dietary/allergy requirements could be improved. Easily rectified for the future so hope this feedback is useful.",United Kingdom,Premier Twin Room,1 night ·,Group,May 2021,24 May 2021,,
9.0,Lovely stay,Lovely little hotel right opposite china town and steps away from all the west end shows perfect location.Room was really nice as we were upgraded by the manager. and staff were lovely.also not to noisy considering it’s opposite a busy street. Breakfast was fine for price. Will definitely return.,The bathroom was I little grubby but addressed by management.,United Kingdom,Premier Double Room,1 night ·,Couple,May 2021,23 May 2021,,
9.0,Superb,"Great breakfast, lovely hotel",,United Kingdom,Premier Double Room,1 night ·,Group,December 2020,16 January 2021,1,
8.0,Good location in the heart of the West End,Good size room and really friendly staff,The hotel closed to the public at 2pm on the Sunday so we couldn’t leave our cases beyond that. We may have chosen another hotel if we had known as it cut our day short having cases to drag around London,United Kingdom,Premier Twin Room,1 night ·,Family,December 2020,19 December 2020,1,
8.0,"Very comfortable stay, great location but get your breakfast from somewhere else.","The stay was really nice, the bed was incredibly comfortable and the bathroom was large, had heated flooring and the shower was huge!","The only issue I had was with the continental breakfast, I understand that it had to be changed due to covid regulations. However, cold toast in a brown bag plus milk in a container with rice crispies wasn't what we expected.",United Kingdom,Club Double Room,1 night ·,Couple,December 2020,16 December 2020,1,
8.0,All good great location worth the money,Nice people welcome nice room,It was hot and couldn't seem to turn the heat down,United Kingdom,Club Double Room,1 night ·,Couple,December 2020,13 December 2020,,
8.0,Great stay,Lovely hotel. Great location abs very good breakfast. Room was comfortable,Bathroom was generally clean but shower screen a bit mildewy. Could do with a deep clean.,United Kingdom,Premier Double Room,2 nights ·,Solo traveller,September 2020,18 October 2020,,
9.0,Fantastic stay,We had booked to stay at the piccadilly London West End Hotel before unfortunately the day before we was due we received an email explaining that this hotel was closed due to health and safety reasons. Our booking was being moved to their sister hotel Montcalm London marble arch. I was a little concerned as this was not the hotel we chose but I am so happy they changed it to this hotel. Te Montcalm hotel was less then a minute walk ro Oxford Street which was an excellent location for us. The hotel was outstanding. The lady who checked us in was very helpful and made check in so easy. She made sure both rooms was ready before we checked in. The rooms was lovely and the beds was very comfortable. We had 2 rooms and both was lovely. There is a window between the bathroom and room where you can see straight into the bathroom.  If you do not want this you can push a button and it changed the glass so you cannot see in.The shower was a rain shower was we all liked.The full English breakfast was very yummy and we also was offered a continental choice too. The staff was very helpful always making sure we had what we needed. I would definitely stay at this hotel again.,We liked everything at this hotel.,United Kingdom,Premier Double Room,1 night ·,Family,October 2020,10 October 2020,,
8.0,Very good,Loved the hotel. Will stay there again.,,United Kingdom,Premier Double Room,1 night ·,Couple,October 2020,8 October 2020,,
9.0,Superb,"Everything! Staff, room and breakfast were all fantastic!",,United Kingdom,Premier Double Room,1 night ·,Couple,September 2020,1 October 2020,,
9.0,Staff very friendly and helpful. Rooms very clean and all needs were met,Location was very good right in the heart of the shopping district. Clean and friendly staff,Corridor areas where a little dark and some small maintenance issues could be done in the room. Metal coming on tv side. Bed based and lots of scuff marks and shower area needs some attention on tiles where water from shower has caused some damage,United Kingdom,Premier Double Room,2 nights ·,Solo traveller,September 2020,30 September 2020,1,
9.0,Great stay,"Perfect location, really comfy beds, we stayed for our anniversary and they put balloons and petals on our bed, staff were lovely too",Nothing,United Kingdom,Premier Double Room,1 night ·,Couple,September 2020,27 September 2020,,
9.0,We especially enjoyed our purchases from the doughnut shop across from the hotel.,The location was excellent for shopping and eating out.,,United Kingdom,Club Double Room,1 night ·,Family,August 2020,27 September 2020,,
9.0,Last minute booking,The rooms are bigger and nicer than they looked on the pictures,,United Kingdom,Premier Double Room,1 night ·,Solo traveller,September 2020,20 September 2020,,
7.0,London stay,"Amazing location, friendly staff, comfy bed, plenty of fresh towels.","Breakfast wasn't great, some furniture was damaged and curtains too, shower was not good at draining. No cleaner although requested during stay",United Kingdom,Premier Twin Room,2 nights ·,Group,August 2020,31 August 2020,1,
8.0,Very good,Staff were brilliant. Everything about the room and stay was good apart from not being able to sleep. I would come again but possibly request a room at the back of the hotel.,There was dirt on the curtains which was a little unsettling. The noise level in the room from outside was very bad and I only managed to sleep for 2 hours. Breakfast was very simple and didnt fill me or my guest up.,United Kingdom,Premier Twin Room,1 night ·,Couple,August 2020,31 August 2020,,
9.0,Superb,"Excellent location,helpful friendly staff",Nothing,United Kingdom,Premier Double Room,1 night ·,Couple,August 2020,30 August 2020,,
9.0,"Testintimes - Brilliant Staff, excellent location",Deserves it’s star rating👍,All good.,United Kingdom,Premier Double Room,2 nights ·,Couple,August 2020,22 August 2020,,
8.0,Generally very good,The hotel staff were very friendly and helpful.,Difficult to regulate temperature in our room 412.Curtain system does not work well and no way to open windows for fresh air.As far as we could tell there was no extractor fan working in the bathroom.,United Kingdom,Club Double Room,2 nights ·,Couple,March 2020,17 March 2020,,
8.0,An amazing weekend trip to the theatre with the family,"I had booked surprise tickets for my wife's birthday to go and see Les Miserables at the Sondheim Theatre and booked the Junior suite for me, my wife and our daughter.  The room was not huge but was ideal for our short stay and although the bed would have been large enough for all 3 of us there was an additional sofa bed already made up.  For location to the Theatre the hotel is unbeatable - we were less than a 1 minute walk from the Sondheim which you can see as you walk out the door and it truly made for an amazing birthday for my wife.  We will definitely stay here again on our next trip.  The location is fantastic, the room was comfortable and the staff were great and all this within a short walk of the underground.",,United Kingdom,Junior Suite,1 night ·,Family,March 2020,16 March 2020,1,
8.0,A pretty good hotel in an excellent location,Comfortable room with good bathroom,We are vegan and had little choice for breakfast.,United Kingdom,Club Double Room,1 night ·,Couple,March 2020,15 March 2020,,
