score,title,likereview,dislikereview,country,rometype,intimelong,people,inrometime,reviewtime,help_vote,unhelp_vote
10,"Located in such a prime area in London, the BEST hotel I could have ever picked! We will be back for sure!",We were upgraded to a better spacious room even without asking - which was a pleasant surprise. Loved the fact I could order eggs of my choice on the side on top of the breakfast spread. Excellent service.,Pillows could have been better - a little flat for my taste but it was not a biggie.,United Kingdom,Premier Double Room,2 nights ·,Couple,October 2022,18 October 2022,,
9.0,Highly recommended to stay if you like to walk around and browse shopping,Best location in London for shopping and exploring all the street shops.The hotel has a nice breakfast.Very hot coffee.,The hotel has some staff shortage.However the service and attitude of staff excellent.Because hotel in in the heart of the area there is no drop off or pick up for the taxi.,Australia,Four-Poster Suite,5 nights ·,Couple,October 2022,25 October 2022,,
9.0,"excellent location, small compact room, very comfy bed",location,The staff could have been nicer,United Kingdom,Premier Double Room,1 night ·,Couple,October 2022,23 October 2022,,
9.0,Excellent location and staff!,"Perfect location, staff amazing, small touches like prosecco on arrival and chocolates make it that little bit more special. Also room was decorated for our birthday which was a lovely touch!",Only issue we had was that sockets in room were a bit loose which maybe need checked,United Kingdom,Premier Twin Room,2 nights ·,Group,October 2022,21 October 2022,,
7.0,The staff made my break very enjoyable.,comfortable and clean. Location was excellent and the staff were exceptional.,The restaurant was only open for breakfast and the bar shut in the afternoon.,United Kingdom,Premier Single Room,2 nights ·,Solo traveller,October 2022,20 October 2022,,
8.0,"All in all an excellent stay, just a shame about the housekeeping letting them down in the room","The location of the Hotel is excellent for theatres, china town.  Nice size rooms and comfortable beds.  It was my friends 70th birthday and they went out of their way by putting a complimentary bottle of prosecco, cake and balloons in the room, could not fault it.",The housekeeping of the room let them down sadly as we found someone's lip balm on the floor plus under the beds had not been vacummed and we also found someone's ear plug on the floor.  Plus the bottom outside of the shower door rail had not been properly cleaned and there was also no toilet brush in the bathroom.,United Kingdom,Premier Twin Room,2 nights ·,Group,October 2022,17 October 2022,,
9.0,"loved it, will go there again","excellent, high standard of accommodation. very Comfortable bed, a bathroom that looked almost brand new. I also feel the breakfast buffet was excellent. just two little pointers, a little storage in the bathroom would be great (cupboard or shelf), and probably a rail to help people getting in and out of the shower/ bath. we will use this hotel again as the location was excellent. 50 yards from Les Miserable theatre","There was nothing not to like, it was excellent all around",United Kingdom,Premier Double Room,2 nights ·,Couple,October 2022,16 October 2022,,
9.0,perfect for the theatre.,"excellent location, friendly staff right in the middle of the west end, soho and Chinatown.Would definitely recommend.",cannot think of anything.,United Kingdom,Club Double Room,2 nights ·,Couple,August 2022,15 October 2022,1,
8.0,Very good,Location is perfect.Good breakfast.Good hospitality.,"The cleaning was not good enough.Small room, not enough closet space.",Israel,Premier Double Room,8 nights ·,Couple,October 2022,12 October 2022,,
8.0,Lovely hotel,"They left a complimentary dessert, bottle of prosecco and balloons for my birthday.",Bit of a wait to check in but nothing to complain about really,United Kingdom,Premier Double Room,2 nights ·,Family,July 2022,10 October 2022,,
7.0,great location but price didn’t match service sadly,location is perfect for the theatre. room was large with comfortable bed and breakfast was very good.,"check in was 2pm but room wasn’t actually ready till gone 3:30 as there were ‘some issues’ with the room. However, there was no toilet roll in the bathroom and when I called reception, the phone didn’t work as it was  unplugged!  The rolls were brought up but there was no apology. Staff were pleasant but check in and check out were slow. We had a room at the front and traffic noise disturbed sleep but I guess that’s the sacrifice for a central location. don’t think I would stay again as price paid didn’t match the service received.",United Kingdom,Premier Twin Room,1 night ·,Family,October 2022,9 October 2022,,
9.0,Superb,Excellent location. Room large and bed comfy.,The shower wasnt very powerful.,United Kingdom,Premier Double Room,1 night ·,Couple,October 2022,6 October 2022,,
7.0,It was good to stay there,Location is absolutely very good,Rooms were very small,India,Economy Double Room,1 night ·,Solo traveller,October 2022,5 October 2022,,
7.0,"amazing location, nice staff.but rooms are not clean.","the location is amazing, the room was relatively spacious. staff is nice.","our room was not cleaned everyday and we had to ask the staff multiple times to send a cleaning lady, who did not clean the room well and didn’t bother to change the sheets.breakfast was the same everyday which was a little boring.",Israel,Premier Double Room,7 nights ·,Couple,September 2022,4 October 2022,,
9.0,"Great position, very clean and very friendly and helpful staff.","Room, position of hotel, staff",N/A,United Kingdom,Premier Double Room,1 night ·,Couple,October 2022,4 October 2022,,
7.0,"ok stay, but good location to get me to marathon start line",comfortable room for a solo traveller,"incredibly noisy, both inside and outside noise",Jersey,Premier Double Room,2 nights ·,Solo traveller,October 2022,4 October 2022,1,
8.0,Very good,Room was nice and clean especially the bathroom. Air con was a godsend. Worth paying extra for the great location.,Would have be great to have more hot &amp; cold vegan and gluten free options at breakfast.,United Kingdom,Premier Twin Room,1 night ·,Couple,July 2022,4 October 2022,,
8.0,Very good,Room was comfortable. Water and fresh fruit was nice. As was the welcome prosecco,Breakfast was not the tastiest.,United Kingdom,Premier Double Room,1 night ·,Couple,October 2022,3 October 2022,,
8.0,excellent,"excellent location, superb breakfast, staff very friendly and efficient.",nothing,United Kingdom,Economy Double Room,1 night ·,Couple,September 2022,3 October 2022,,
7.0,Good location with friendly staff.  I will go there again.,Staff were attentive.,Elevator was out of order for a day,United States,Premier Double Room,4 nights ·,Solo traveller,September 2022,2 October 2022,,
9.0,excellent stay in a very conveniently positioned hotel. Great breakfast.,very convenient position.,nothing other than it was a bit expensive,United Kingdom,Premier Double Room,1 night ·,Couple,September 2022,1 October 2022,,
9.0,Superb,"Location, friendly staff &amp; good breakfast",Small double bed,United Kingdom,Premier Double Room,1 night ·,Couple,September 2022,1 October 2022,,
8.0,Very good,"hotel was very nice, staff were friendly and helped when asked",,United Kingdom,Junior Suite,1 night ·,Family,September 2022,29 September 2022,,
8.0,Very good,Prime location. Good breakfast.,Rooms are a bit small (though expected for these locations).,Israel,Premier Double Room,5 nights ·,Couple,September 2022,27 September 2022,,
7.0,Good,Enjoyable breakfast.Good central location.Friendly staff.,Expensive for the room and hotel facilities. Small rooms for the cost.,United Kingdom,Premier Double Room,1 night ·,Solo traveller,September 2022,26 September 2022,,
9.0,A great hotel in an excellent location!,"The location is excellent and lively! All the main streets are within walking distance, and the subway and bus stops are too. The rooms were nice and spacious, fitted with all the necessary amenities. The staff were friendly and professional. A special thank you to Donia and Mina for making our stay more comfortable and accommodating.",,Kuwait,Junior Suite,7 nights ·,Solo traveller,September 2022,24 September 2022,,
9.0,Night out at the theatre,"Really nice hotel, staff were friendly and room was stunning.",The only minor issue was we had some lovely mood lights above our bed but a good number of lights werent working.  Made us laugh though as we named a few unknown constellations..the giant pizza..the shower head.,United Kingdom,Premier Double Room,1 night ·,Couple,September 2022,23 September 2022,,
8.0,Very good,this is my home away for more than 14 yearsalthough the staff has always been the best I've ever encountered this time doiha at the front desk exceeded all my expectation on the level of service and care,doiha at the front desk did her best to fine me a room with a bath as requested by my but unfortunately the maintenance couldn't find a (in the 3 days 2 nights i was there) bath stopper so i couldn't take a bathalso the cleaning of the room was not at the level i amused to in this hotel,Kuwait,Premier Double Room,2 nights ·,Solo traveller,September 2022,23 September 2022,,
8.0,Lovely hotel in a great location.,"Good location. Short walk from Piccadilly Circus and close to theatres. Breakfast was excellent with lots of choice. The staff were so friendly and helpful, particularly the reception staff who were welcoming.","Our room was lovely on the third floor. It was comfortable, clean and spacious. Only downside was the noise from outside - late night traffic etc - to be expected given the location.",United Kingdom,Premier Double Room,1 night ·,Group,September 2022,22 September 2022,,
7.0,Good,,noisy outside at early morning,United Kingdom,Premier Twin Room,1 night ·,Group,September 2022,22 September 2022,,
9.0,Superb,Location Room comfortable Staff nothing too much trouble for them. Always very helpful.,No bar or restaurant available other than breakfast.,United Kingdom,Premier Double Room,3 nights ·,Couple,September 2022,22 September 2022,,
9.0,2 day visit,Spa ious rooms.well appointed great location,No spa,United Kingdom,Premier Twin Room,1 night ·,Group,September 2022,21 September 2022,,
8.0,Very good,It was a well presented room and hotel. The staff were very nice and helpf,Our toilet was alittle broken… sometimes it would keep running. The air on vent was very condensated with water drips all over it.,United Kingdom,Premier Twin Room,1 night ·,Group,August 2022,21 September 2022,,
8.0,Great for a night in the middle of London,The staff were excellent with our stay and couldn’t be more helpful. Breakfast was very good,Standard rooms are a little on the small side.,United States,Premier Double Room,1 night ·,Couple,September 2022,16 September 2022,,
7.0,ok,"Good location for the theatres, room looked clean.","Bathroom rather small, no room around the wash basin. Staff didn't deliver all our bags to our rooms even after a reminding phone call, I had to go down to reception and insist they produce them.The mattress topper was rather grubby looking.",United Kingdom,Premier Double Room,1 night ·,Solo traveller,September 2022,15 September 2022,,
8.0,Great location good breakfast some things a little bit tired,Breakfast was good location excellent for seeing a show,The shower in our room was a little bit tired,United Kingdom,Economy Double Room,1 night ·,Couple,September 2022,15 September 2022,,
9.0,location and staff,location was great for what was required and friendly staff,,United Kingdom,Premier Double Room,1 night ·,Couple,September 2022,12 September 2022,,
9.0,amazing staff and in a fantastic location,so central for the theatre and China town :),n/a,United Kingdom,Premier Twin Room,1 night ·,Group,September 2022,12 September 2022,,
8.0,"Fabulous location, very kind and super helpful staff but rooms needs some refurbishment.",the excellent staff,dirty old curtains in the room!!!,United Arab Emirates,Premier Twin Room,1 night ·,Group,September 2022,10 September 2022,,
8.0,Very good,We were well looked after and the hotel location was perfect for our theatre trip,,United Kingdom,Premier Double Room,1 night ·,Couple,September 2022,10 September 2022,,
7.0,Good,"The rooms are very spacious (other than the compact room we had on first night, the bed is more like a large single than a double and the room is very small, so is the bathroom). We stayed in the club double for our two remaining nights and the room was lovely, the blackout curtains are amazing, the room stays really dark until you open them. Aircon was lovely. The rooms are bright and the decor is nice. Location is amazing and staff were very friendly and accommodating. I would stay here again.","There was a problem with our room so we were originally told we had to move to their other hotel. I was not contacted at all to discuss this beforehand despite arriving at 8:30pm. We were then given a compact room (which really was tiny, bed wasn’t comfortable and I felt very closed in, we were then offered an upgraded room on our next two nights which was wonderful. I was also give a 20% refund and a complimentary bottle of bubbly for the inconvenience. I feel that the staff were very apologetic and really wanted to ensure our stay was the best it could be. We had a wonderful stay. It just would have been nice to have been notified before arrival as we were very tired.",United Kingdom,Premier Double Room,3 nights ·,Couple,September 2022,10 September 2022,,
8.0,Very good,Great location,Breakfast area small,United Kingdom,Premier Double Room,2 nights ·,Couple,September 2022,9 September 2022,1,
9.0,Superb,The hotel and reception staff were expanding very helpful,,United Kingdom,Premier Double Room,3 nights ·,Couple,September 2022,5 September 2022,,
7.0,a stay on the busiest and noisiest west end area.,right across Chinatown and most west end shows.,the pictures look away better than the actual room. much smaller room than we expect. very noisy at night from the outside surroundings.,Hong Kong (China),Premier Double Room,2 nights ·,Family,August 2022,4 September 2022,,
9.0,Superb,Lovely room,Nothing,United States,Junior Suite,1 night ·,Family,August 2022,4 September 2022,,
9.0,Excellent location to attend theatre shows and visit sights in central London.,"Excellent central location for theatre district - just a short walk to the shows we’d booked to see (The Cursed Child and The Mousetrap). Not far from tube stations to visit other sights in London. It was our 20th wedding anniversary and upon arrival we found wine, chocolate covered strawberries and petals on the bed, along with a card from the staff - this was a lovely touch and much appreciated. Breakfast, which was included on our booking, was lovely and there was a very good selection of items available - both hot and cold. We were seated straight on both mornings of our stay.","Our room was on the first floor and directly above a souvenir shop that played very loud music, which could be heard in the room until at least 11.30pm. We stayed mid-week so I don’t know if the shop stays open longer on a weekend! If you want to have an early night ask to not be put in this room.It was annoying but luckily didn’t ruin our stay!",United Kingdom,Premier Double Room,2 nights ·,Couple,July 2022,4 September 2022,,
9.0,Good quality hotel in the heart of theatre land,"The stay was part of my husband’s birthday treat and the staff went above and beyond to provide us with a lovely room, cake and bubbles to help celebrate. Given we were on Shaftesbury Avenue, the room itself was very quiet during the night and the bed was super comfy.","We had a flickering light in the room, but not an issue as the room was well lit from a variety of different light sources.",United Kingdom,Premier Double Room,1 night ·,Couple,September 2022,3 September 2022,,
9.0,Superb,"Guest Services team were very kind and accommodating! Room was very comfortable, and bathroom was quite nice!",,United States,Premier Twin Room,1 night ·,Group,September 2022,2 September 2022,,
8.0,Nice location but not worth the money,Location Breakfast,Previous guests shorts left in bathroomAsked for fan and was asked if the air con was on,United Kingdom,Premier Double Room,1 night ·,Couple,August 2022,30 August 2022,,
8.0,"we had an enjoyable stay ,our room was upgraded when we got there and room was enormous,the maid came to see if we was c","central location for sightseeing,shops and theatrescomfortable beds and lovely breakfast,would stay there  again",breakfast room very small and no bar,United Kingdom,Premier Double Room,1 night ·,Family,August 2022,30 August 2022,,
9.0,excellent hotel in perfect location. Rooms were immaculate and staff were friendly. would recommend,property was well located and rooms were excellent,Rooms and location,United Kingdom,Premier Double Room,1 night ·,Couple,August 2022,29 August 2022,,
7.0,Good,Location was great,Very expensive for our small rooms and could be cleaner,United Kingdom,Premier Single Room,1 night ·,Family,August 2022,29 August 2022,,
8.0,nice,excellent location,it’s not a 5 star as it says on here and other places,United Kingdom,Junior Suite,3 nights ·,Family,August 2022,29 August 2022,,
7.0,Okay stay…,"The best thing about the property is it’s location. So close to Soho, Piccadilly Circus, Leicester Sq etc…The rooms were clean and the staff very friendly and professional.",The gym was closed. The air con didn’t work.One of the rooms we stayed in was TINY.Bed is only a double.,Australia,Premier Double Room,1 night ·,Couple,August 2022,28 August 2022,,
8.0,"Great location, polite and helpful staff",Location spot on,All good,United Kingdom,Premier Double Room,2 nights ·,Couple,August 2022,28 August 2022,,
7.0,Good,Beds are very comfortable,Didnt think it was worth the money for one nightSmall roomsBreakfast wasnt great,United Kingdom,Premier Double Room,1 night ·,Couple,August 2022,28 August 2022,,
9.0,Close proximity to shows and central London. Tourists dream.,The location was very good.The staff were friendly and helpful.Breakfast was relaxed and sufficient,,Australia,Premier Double Room,2 nights ·,Couple,August 2022,28 August 2022,1,
8.0,we had an enjoyable stay in London,"The location is very central,had a very comfortable bed and lovely breakfast",The shower was stone cold !,United Kingdom,Junior Suite,1 night ·,Family,August 2022,27 August 2022,,
7.0,Good,Breakfast was great. Location was perfect.,,United Kingdom,Premier Double Room,1 night ·,Couple,August 2022,27 August 2022,,
7.0,really enjoyed would use again and recommend but stipulate which rooms . fortunately we  were moved,"all of it , rooms a bit small and breakfast room a bit cramped . Staff fabulous",breakfast and breakfast room,United Kingdom,Premier Twin Room,1 night ·,Family,July 2022,25 August 2022,,
9.0,Excellent t hotel,Quality accommodation.,Brown curtains in room,United Kingdom,Junior Suite,1 night ·,Family,August 2022,24 August 2022,,
8.0,"great location to restaurants, activities and comfortable stay","I enjoyed the proximity to many of London’s destinations. Very walkable to Soho, Chinatown, Leicester Square, high street, and Covent Gardens.","While centrally located, the noise from neighboring Soho bars/restaurants was present. We were located on the first floor and could hear activity throughout most of the night.",United States,Premier Twin Room,3 nights ·,Group,August 2022,23 August 2022,,
8.0,"Very enjoyable, suited our requirements",Staff very friendly and always helpful,Disappointed that we were not notified that there was no spa during our stay,United Kingdom,Premier Twin Room,2 nights ·,Family,July 2022,23 August 2022,,
9.0,Great Location London Hotel.,This hotel is a great location for the London theatres. The staff are helpful and friendly. We were celebrating our golden wedding anniversary and they made a special effort to decorate our room. We will stay at this hotel next time we go to London. The breakfast was very good.,Nothing all good for us.,United Kingdom,Club Double Room,2 nights ·,Couple,August 2022,22 August 2022,,
7.0,Good,nice hotel and good location for the theatre we went to,air conditioning wasn’t working on one of the hottest day’s this year,United Kingdom,Premier Double Room,1 night ·,Group,August 2022,22 August 2022,,
7.0,staff were excellent and extremely helpful….,location was fantastic.,the beds were uncomfortable,United Kingdom,Premier Double Room,2 nights ·,Couple,August 2022,22 August 2022,,
8.0,"Lovely short break,but expensive!!","Excellent location for west end theatres.Lovely clean room,with fruit,bottled water,toiletries as",Very small restaurant for breakfast. I asked in advance for fruit platter and a cake for my partner’s 50th but never got it,United Kingdom,Four-Poster Suite,1 night ·,Couple,August 2022,21 August 2022,,
8.0,"good location, staff very welcoming, room has all you need.","The staff were very welcoming and they had decorated the room, as we were celebrating a birthday . Room had everything you needed . Location is excellent and in easy walking distance of exhibitions, theatres and shops.","Breakfast was to 10.30 and we ate at 10. Staff were clearing as soon as you put something down, which was not relaxing.Someone arrived at 10.25 and they were told they had 5 minutes to get their breakfast before the food was cleared.Cleaning staff came round twice on day we were checking out -an hour before checkout time. They made you feel rushed to leave and it was an expensive room.",United Kingdom,Junior Suite,1 night ·,Family,August 2022,18 August 2022,,
9.0,Really lovely hotel and staff,"The hotel is in a great central location. The staff were lovely, kind and helpful. The room we were given had amazing views over the london skyline all the way out to Canary Wharf. When I mentioned that the trip was to celebrate my mum's birthday they went out of thier way to make the trip feel special.","Its a shame there was no bar or restaurant in the hotel (breakfast is served in a little sort of add on cafe next door that can be reached through reception), but there are obviously loads of places to get food and drink in the area.",United Kingdom,Premier Twin Room,1 night ·,Family,August 2022,18 August 2022,,
9.0,Excellent,Overall superb hotel and service only an additional lunch or dinner at the hotel would also have made things a little better,,India,Premier Single Room,1 night ·,Solo traveller,August 2022,18 August 2022,,
9.0,Fantastic central location in good hotel,Fantastic location just off Piccadilly Circus. Really helpful staff. Our room was ready earlier than the booked time. Room was clean and comfortable.,"The breakfast room is small and we had to wait a few minutes to be seated on our first day, we attended a little earlier the next morning to be seated more promptly.",United Kingdom,Premier Double Room,2 nights ·,Family,August 2022,17 August 2022,,
8.0,best location in the city.,best location.close to everything,the shower at our room is not work well.,Switzerland,Club Double Room,3 nights ·,Couple,August 2022,15 August 2022,,
9.0,I would recommend this hotel highly for 1st time visitors due to its excellent location.,"excellent location, friendly staff, great breakfast, efficient professional taxi service to airport arranged through hotel",air conditioning wasn’t working properly during much of our 3-day stay … heat wave in London,United States,Junior Suite,3 nights ·,Family,August 2022,15 August 2022,,
8.0,Very good,it’s location,"The bar was closed the whole time we were there, could nt sit and have a drink in the hotel bar after our show",United Kingdom,Premier Double Room,1 night ·,Group,August 2022,14 August 2022,,
7.0,Good,location was fantastic. staff were very friendly. let us check in early,"we were meant to have a double bed, but it was two single mattresses on a base that kept sliding apart and creating a massive gap. very uncomfortable.",United Kingdom,Economy Double Room,1 night ·,Couple,August 2022,14 August 2022,,
8.0,Very good,Clean room with everything we needed for our stay Inc free bottled water and fruit. comfy beds and aircon we could control ourselves. Breakfast room was a bit busy but staff were very nice as was breakfast. Nice to have gluten free options too.,,United Kingdom,Premier Twin Room,1 night ·,Family,August 2022,14 August 2022,1,
7.0,Good,,Air conditioning not workin properly in the room.  Couldn’t get it lower than 19 degrees.  Reported it at reception but nothing was done.  Weather very hot so really needed room to be cooler.,United Kingdom,Premier Twin Room,3 nights ·,Family,August 2022,14 August 2022,,
8.0,very pleasant staff and location was excellent.,location,size of the room,Ireland,Premier Double Room,2 nights ·,Couple,July 2022,13 August 2022,,
8.0,"Lovely location, lovely room","Very clean comfortable room, lovely bed and receptionist was just lovely, nothing was to much trouble, an asset to your company",Shower did not drain quickly but overall a nice ensuite,Australia,Premier Double Room,1 night ·,Couple,August 2022,11 August 2022,1,
8.0,Very good,Beautiful room. Lovely view.,,United Kingdom,Premier Twin Room,1 night ·,Family,August 2022,11 August 2022,,
