score,title,likereview,dislikereview,country,rometype,intimelong,people,inrometime,reviewtime,help_vote,unhelp_vote
3.0,Poor value for money,Not a lot location design is quite poor extremely noisy even in the room it was to hear lots of noise outside wouldn't ever stay again,Dirty had to wait until  14.30 for a room asked for early booking the waiter tipped coffee all over my wife breakfast in the morning they tried to make out if you go down for breakfast later it would be better as not so busy the truth fact was there was not enough seating area the rooms are dark and outdated carpet quite worn bathroom tiles stained especially in the shower not very hygienic windows are stinking dirty mould which I have photographs,United Kingdom,Premier Twin Room,1 night ·,Couple,November 2021,5 November 2021,,
3.0,Poor,Nothing,If you stay in this hotel and get room 104 move! Overlooks the street and sound proofing is non existent so guess what you don't get any sleep. Manager was going to call me to discuss nothing. There are much better hotels in London for less money. Wont go back.,United Kingdom,Premier Single Room,1 night ·,Solo traveller,September 2021,6 September 2021,,
3.0,"Not the hotel we booked, very, very disappointed.",The hotel room was very clean and tidy.Pleasant cleaner.Reception staff and Porter polite and helpful,"Our biggest problem is that you sent us an email at 06.30 on the morning of our travel to tell us we were no longer staying at The Piccadilly but were now going to be staying at the Montcalm, Marble Arch.  We were not given any choice and at that time, it was difficult to start looking at other hotels anyway as we were starting our journey.  Whilst we understand there is a pandemic,, we are certain that you were aware that the hotel was closed before 06.30 on the morning of our travel.  The reason we chose The Piccadilly was because it was the ideal place to stay for the places we wanted to visit and the restaurants we had booked, therefore, staying at The Montcalm was very inconvenient to us.We did not feel the Montcalm was of a 5* standard.  The room we were given was very standard considering we had been forced to move to another hotel.  The breakfast was buffet style, which we were very concerned about.  We have visited other hotels recently and been told it was only table service due to the pandemic so to see people handling produce, cutlery and plates was quite alarming given the increase in infections currently.  The staff were reasonably quick in bringing tea and coffee to the table but if you required anything else, it took time to not only get their attention but to actually have the item brought to the table.The food was also of a disappointing standard and felt like the cheapest version of everything had been purchased.  Nothing tasted nice.  Bacon was not cooked properly and was soggy, sausages tasteless, eggs looked unappetising and watery.We used the hotel bar one night.  The barman had no Bailey's due to ""a large party the night before""!! and no nuts or crisps which we felt should be pretty standard and complimentary for a so called 5* hotel.Coffee was good.Fruit bowl was good.",United Kingdom,Premier Double Room,3 nights ·,Couple,June 2021,7 June 2021,,
1.0,Awful,Nothing,Everything,United Kingdom,Premier Double Room,1 night ·,Couple,May 2021,22 May 2021,,
1.0,Our alternative hotel was very nice but completely inconvenient for our plans.,Nothing as we didn't stay there,"Being informed of our move of hotel the night before was completely unacceptable, if we'd have more notice we would have changed hotels ourselves to somewhere convenient for our plans and parking that had been booked.",United Kingdom,Premier Double Room,1 night ·,Couple,October 2020,16 October 2020,,
1.0,Bad,There was nothing good as this hotel is SHUT!!!!!,This hotel is shut. Please stop accepting bookings for this hotel!,United Kingdom,Premier Double Room,1 night ·,Couple,October 2020,15 October 2020,,
1.0,Bad,Poor,Bad management,United Kingdom,Premier Double Room,1 night ·,Couple,September 2020,9 October 2020,,
1.0,Wasn’t even open,Nothing,Everything,United Kingdom,Premier Double Room,1 night ·,Couple,August 2020,13 September 2020,,
1.0,Berbat,"You sold the indoor space to me, I will complain about you, You could not answer the phone.  The hotel you were driving was very far from the city. I had a lot of trouble.","You sold the indoor space to me, I will complain about you, You could not answer the phone.  The hotel you were driving was very far from the city. I had a lot of trouble.",Turkey,Premier Double Room,5 nights ·,Solo traveller,August 2020,21 August 2020,,
1.0,Started badly ended up excellent,The hotel was not open and we were told to go to Marble Arch Montcalm,The Montcalm Marble Arch were excellent they upgraded us and took very good cars of us,United Kingdom,Premier Double Room,1 night ·,Couple,August 2020,17 August 2020,,
6.0,"Hotel over booked, so they moved us to another one, very nice.","Booking.com overbooked this hotel, on arrival to Euston, the hotel called me to apologise that they had no room for us, however, they very kindly moved us to another one of their hotels, upgraded our room and didn't charge any extra. Cannot fault the customer service.",Cannot comment as didn't actually stay here in the end.,United Kingdom,Premier Twin Room,1 night ·,Group,July 2022,15 August 2022,,
2.0,Very poor,location is good,The Ac was not working too much hot inside even ask the hotel response was late price is higher as conpare to neighhbood,United Arab Emirates,Premier Double Room,2 nights ·,Group,July 2022,14 July 2022,,
10,Exceptional,Staff are very attentive. Location is spot on!,,Jersey,Premier Twin Room,1 night ·,Family,April 2022,22 April 2022,,
1.0,Bad,denied all knowledge of my booking even though I had e-mail confirmation!! they obviously over book the rooms then sell the rooms to the highest bidder! Dreadful service!,,United Kingdom,Premier Double Room,2 nights ·,Couple,November 2021,11 December 2021,,
5.0,passable. will not be returning,the tea in the room was high quality. the bed was comfortable,room- a few things didn't work on arrival including the telephone.breakfast was passable- burnt baconthe bedsheet didn't fully cover the bedonly Indian food available from kitchen during the day,United Kingdom,Premier Double Room,1 night ·,Couple,November 2021,2 November 2021,,
2.0,Very poor,,There was someone else’s night wear still in the room also hairs in &amp; on the bed,United Kingdom,Premier Double Room,1 night ·,Couple,August 2021,17 September 2021,,
5.0,Passable,,"We booked at the end of May and were notified a couple of days before travel that the hotel had insufficient bookings and so was not opening. They transferred us to the Montcalm Marble Arch, their sister hotel. Although a bit further from where we had wanted the Montcalm hotel was superb.",United Kingdom,Premier Double Room,2 nights ·,Couple,June 2021,30 July 2021,,
6.0,"Disappointing as the room was, it did not spoil a much needed change of scene due to the pandemic.",Close to the theatre and tourist attractions.  The beds were really comfortable.,"The room obviously has not been used, so it should have been aired, window open. There was a musty smell as soon as we entered the room. The net curtains were dirty as were the windows, the chair in the room was tatty and for a room the cost £265, I was disappointed .",United Kingdom,Premier Twin Room,1 night ·,Family,May 2021,30 May 2021,,
8.0,Very good,very good hotel,additional costs for mini bar required upfront,United Kingdom,,1 night ·,Couple,August 2022,7 August 2022,,
9.0,a good stay in a great location,"excellent location, great room and beds extra comfy. staff went extra mile as it was my friends birthday",water pressure is low therefore shower isn’t great.,United Kingdom,,1 night ·,Group,June 2022,12 June 2022,,
9.0,Superb,Excellent location. Right at the heart of west end,,Malaysia,,4 nights ·,Family,May 2022,31 May 2022,,
7.0,value for money,location,No restaurant,Nigeria,,8 nights ·,Solo traveller,May 2022,11 May 2022,,
8.0,Very good,Friendly staff and very clean and today hotel. Room immaculate. perfect location. would definitely stay again.,Bar wasn’t open but reception offered room service and a free bottle of wine on the house.,United Kingdom,,2 nights ·,Couple,April 2022,12 April 2022,,
9.0,excellent hotel well staffed good facilities and complimentary items very comfy bed lovely shower,location  comfort,no problems,United Kingdom,,2 nights ·,Family,March 2022,26 March 2022,,
7.0,delightful,"how lovely the staff were, we were given a room upgrade, free bottle of wine and cake due to it being my birthday. it was a lovely room and had plenty of room.",the breakfast in the morning was cold and not very nice.,United Kingdom,,1 night ·,Group,February 2022,1 March 2022,,
8.0,"would definitely visit again, can’t beat the location, clean, tidy and excellent room",Excellent location excellent room staff friendly and helpful,"dropped off bags early, but was not taken to secure location. left in reception area. breakfast - didn’t match the experience",United Kingdom,,1 night ·,Family,February 2022,25 February 2022,,
9.0,wonderful hotel,loved the LED stars above the bed,"slight issue with toilet, other than that was amazing",United Kingdom,,1 night ·,Couple,February 2022,14 February 2022,,
8.0,very comfortable,the location was ideal,the views from the room were not that great,United Kingdom,,1 night ·,Family,January 2022,7 January 2022,,
8.0,"clean room, friendly staff, ideal location",location was excellent,,United Kingdom,,1 night ·,Group,November 2021,6 December 2021,,
7.0,Small Bed,LocationStaff,Small bedSmall shower cubicle,United Kingdom,,2 nights ·,Couple,November 2021,14 November 2021,,
9.0,Superb,"perfect location, excellent staff and great clean rooms!",,United Kingdom,,1 night ·,Couple,November 2021,5 November 2021,,
8.0,would definitely stay again !,"location ,  friendly staff , very comfortable beds",nothing,Ireland,,3 nights ·,Family,November 2021,5 November 2021,,
7.0,Great Location but a little tired,location was great,"Looks tired, Room was for two people but only 1 of everything like glasses coffee cups dressing gown.",United Kingdom,,1 night ·,Couple,October 2021,25 October 2021,,
7.0,Good,Location,Bed was uncomfortable. Kept rolling into the middle.,United Kingdom,,1 night ·,Couple,October 2021,18 October 2021,,
8.0,"Enjoyable trip, our 1st in London for 2 years","Although our room was small it was well decorated and comfortable. Breakfast was very good, the staff were all friendly and efficient .","The price! Very small bedroom and bathroom,  there was no toilet paper in the bathroom 🙃 also no English breakfast tea, we had to ask for both.Dissapointing that a hotel in Central London didn't supply English tea!!",United Kingdom,,2 nights ·,Couple,October 2021,7 October 2021,,
9.0,Great but would have like to eat in the dining room,"Lovely hotel, foyer, location and staff","We didn't like that they were still serving breakfast pre-made to the door despite the lifting of covid restrictions. Not really a fan of eating breakfast in bed, especially without plates or cutlery!",United Kingdom,,1 night ·,Couple,July 2021,6 October 2021,,
8.3,Very good,Was a great location and very clean  Staff were very friendly,Was told we would receive a complimentary bottle of Prosecco as special occasion which didn’t receive. Very small bathroom.,United Kingdom,,2 nights ·,Couple,September 2021,3 October 2021,,
8.0,"Great staff, small room.","The staff were absolutely amazing. Very welcoming, polite and helpful. Nothing was too much trouble for them.","Our room was pretty small considering how much we paid but then I don't know the going rate for rooms in London. It was also extremely noisy at night (but that isn't the hotels fault) Breakfast was good, but very busy on the weekend.",United Kingdom,,2 nights ·,Couple,October 2021,2 October 2021,,
9.0,Superb,"Staff very friendly &amp; accommodating, ideal location",My father in laws room hadn't been cleaned when we returned from day out,United Kingdom,,2 nights ·,Family,October 2021,2 October 2021,,
9.0,Superb,A very comfortable and friendly hotel in easy access of entertainment,The noise at night outside the hotel,United Kingdom,,1 night ·,Solo traveller,September 2021,29 September 2021,,
7.0,A bit mixed!,The staff were very polite and helpful. We were able to leave our luggage after check out and collect later. The room was plenty big enough.,"The breakfast room was small and cramped and the food wasn't great. Plates and crockery weren't overly clean.The room was facing on to Shaftesbury avenue and you could hear all the noise coming from the street, the windows didn't seem to dampen the sound.",United Kingdom,,1 night ·,Group,September 2021,19 September 2021,,
7.0,Good,Staff were generally helpful. Room is clean. Prime location.,Was missing a lot of amenities like kettle and hairdryer but staff provided them immediately upon request. Staff were not wearing masks.,United Kingdom,,2 nights ·,Solo traveller,September 2021,2 September 2021,,
8.0,Very good,Was near to our theatre,Had to ask for towels.,United Kingdom,,1 night ·,Couple,August 2021,25 August 2021,,
9.0,Superb,I liked the mirrored door in the hallway that my other half walked into thinking it was the correct way to go haha.,,United Kingdom,,1 night ·,Couple,August 2021,6 August 2021,,
8.0,Lovely hotel but very noisy!,Clean comfortable room.plenty of space in the room.The staff were very pleasant and helpful.excellent location for attractions,The  breakfast room was very small for the number of guests.not keen on a wet room style bathroom.vey noisy if you are at the front of the hotel,United Kingdom,,1 night ·,Family,August 2021,1 August 2021,,
8.0,"Hotel excellent, breakfast disaster.",Location and comfort.,"The breakfast was terrible, in fact they just should not have bothered.   It arrived at your room on a tray with plastic containers ofwarm milk and fruit, cereal, yogurt and a brown bag contained warm droopy toast and a couple of small crossants.  Tea (which was stewed) was in disposable cups. There was plastic cutlery and portions of butter/jam, oh and cartons of orange juice.  For a central London Hotel was expecting so much better.",United Kingdom,,2 nights ·,Couple,July 2021,13 July 2021,,
8.0,"Spacious room, incredible bath and lovely staff","The staff were very helpful and patient, the room was spacious and the bath was the best bath I have ever seen! Also the quality of the complimentary products was great",Confusion surrounding breakfast containing cows milk after I told them I was allergic to dairy,United Kingdom,,1 night ·,Couple,June 2021,5 July 2021,,
8.0,Very good,Location and lovely room,Breakfast was in the room and not restaurant. Not very appetising. We have stayed in other hotels and they have still managed to put on full service breakfast. Also we’re not told that breakfast would only be continental in room when we booked,United Kingdom,,1 night ·,Couple,June 2021,5 June 2021,,
8.0,Fab location and good value,"The location was perfect for all parts of the West End.   Room was comfortable and clean.  Reception staff were very friendly.   Breakfast was lacking in service a bit as we had to ask for milk for the coffee,  a glass for the water and butter for the toast",,United Kingdom,,1 night ·,Couple,September 2020,24 September 2020,,
9.0,Absolutely lovely,Reception were excellent Room was amazing Little touches were so much appreciated for my birthdayRestaurant waiter was a little slow,Cooked Breakfast could do easily be included in price,United Kingdom,,1 night ·,Couple,March 2020,14 March 2020,,
9.0,Superb,"We had a wonderful stay at the hotel. The hospitality and service was excellent from beginning to end, we will be back....thank you!  Sadly we did not enjoy the complimentary Continental breakfast during our stay as the hotel breakfast room was far too busy.  However, there are many good food choices in the area Bar Bruno on Wardour Street is the best, an absolute treasure, you must visit this place! They serve the best full English breakfast in London, fantastic, friendly service and delicious lunch and dinner options too....try it, you won’t regret it!",Breakfast room,United Kingdom,,2 nights ·,Couple,March 2020,8 March 2020,,
8.3,Very good,It’s location,When we first arrived we were put in the wrong room with a dirty cushion and black hair on the pillow,United Kingdom,,1 night ·,Couple,March 2020,8 March 2020,,
8.8,Fabulous,Good location,Felt quite dark but nice rooms,United Kingdom,,1 night ·,Solo traveller,March 2020,6 March 2020,,
9.0,Superb,Great location,,United Kingdom,,1 night ·,Couple,February 2020,5 March 2020,,
7.0,"Lovely room, shame about the breakfast",Room was lovely,Breakfast was disorganised and there are not enough seats for the number of guests,United Kingdom,,1 night ·,Couple,March 2020,1 March 2020,,
7.0,Good,,Breakfast location to small for the hotel occupancy,United Kingdom,,3 nights ·,Couple,March 2020,1 March 2020,,
9.2,Superb,Staff excellent and the breakfast was great.,The only downside was the room was very cramped but we would definitely stay there again,United Kingdom,,2 nights ·,Couple,February 2020,26 February 2020,,
7.9,Good,Location,Carpets kinda old,Indonesia,,2 nights ·,Solo traveller,January 2020,3 February 2020,,
8.0,"Great stay, great location","Great stay, welcoming staff, small glass of Prosecco on arrival, comfortable room, welcoming staff at breakfast.",,United Kingdom,,1 night ·,Couple,January 2020,1 February 2020,,
7.1,Good,Nice staff,"The bathroom and also the main room had a nasty smell, wasn’t properly cleaned, the cleaners did not rinse the mops.",Latvia,,2 nights ·,Couple,January 2020,26 January 2020,,
9.0,Theatre break,"The room was excellent. We were upgraded, I'm not keen on four poster beds, but quite happy to sleep in that one Reception staff were brilliant.We were there to go to a show and its situated close enough to theatre land you didnt need to use public transport to get around.","The breakfast could of been better, and the dining area is nowhere near big enough for the amount of people in the hotel. The items in the mini fridge were expensive for what they were.",United Kingdom,,1 night ·,Couple,January 2020,24 January 2020,,
8.3,Very good,Location,Had a strange odor from the cleaning supplies.,United States,,2 nights ·,Group,January 2020,5 January 2020,,
8.0,Good location and value for money.,"Location very good, short walk from everything. Staff very polite and room good.","Breakfast room too small for so many people and not much food to select from, room clean but there was some trash in the hallway a few times. The bed was a bit too short (or we too tall!) but otherwise the room was great. Was hoping for a 5 star experience but didn't quite get that.",Iceland,,3 nights ·,Couple,December 2019,26 December 2019,,
9.0,Enjoyed it,,Breakfast could have been better,United Kingdom,,2 nights ·,Family,December 2019,21 December 2019,,
9.2,Superb,Staff were lovely. Very welcoming and catered to all our needs,Cleaning was done a little late.,United Kingdom,,2 nights ·,Couple,November 2019,28 November 2019,,
8.0,Very good,,espresso not included in breakfast price,Latvia,,3 nights ·,Solo traveller,October 2019,20 November 2019,,
8.3,Very good,Excellent location and staff were lovely,Rooms too noisy.. could hear everything!!!!! From next door!!,United Kingdom,,1 night ·,Couple,October 2019,4 November 2019,,
7.0,great night sleep but poor breakfast.,Room was spacious so we had plenty of space to get ready.,Considering how much we paid for the night stay we were not too impressed with the breakfast. We weren’t asked what we would or wouldn’t like with our English breakfast and I left most of it.,United Kingdom,,1 night ·,Group,March 2022,31 March 2022,,
8.0,It was a bit noisy from the street below,It was a lovely breakfast,There was lots of noise outside on the street,United Kingdom,,2 nights ·,Family,August 2021,22 August 2021,,
7.0,Adequate for purpose,"Breakfast and location were great. Staff were nice and friendly, very helpful and felt quite safe inside",I was moved to the Marble Arch sister hotel due to over booking on their system. The sink had problems and water took ages to drain.,United Kingdom,,1 night ·,Couple,August 2020,24 August 2020,,
7.9,Good,Within easy access to Central London.  Friendly staff.,Rather noisy at night.  Sometimes they forget to clean the room.,Hong Kong (China),,22 nights ·,Couple,January 2020,10 January 2020,,
10,great location for west end,great location,"lack of bar area, there was a tiny bar area where you had breakfast but not even sure it was open",United Kingdom,,1 night ·,Group,June 2022,27 June 2022,,
9.6,Exceptional,,"The A/C was very weak, but that’s to be expected in Europe lol",United States,,4 nights ·,Group,May 2022,1 June 2022,,
10,we will be back again and again. perfect,"perfectly placed for the theatres , clean , great breakfast, comfy beds and the staff were brilliant.",,United Kingdom,,2 nights ·,Couple,May 2022,22 May 2022,,
10,relaxing stay and excellent facilities. staff were excellent,great location and excellent staff,there was nothing not to like,United Kingdom,,1 night ·,Family,March 2022,14 March 2022,,
10,We had a lovely stay and as we were celebrating a belated Anniversary with a show the hotel very kindly updated our room,"The location is excellent very central for the Theatres, Soho, China Town and Leicester Square.  Although central very quiet once inside.  Staff were lovely and cooked breakfast excellent.",,United Kingdom,,1 night ·,Couple,February 2022,24 February 2022,,
10,"it was perfect, all the staff were very polite &amp; helpful","Great location, very clean, under floor heating in the bathroom, bottles of mineral water, plus tea &amp; coffee facilities. very nice hotel",,United Kingdom,,1 night ·,Family,January 2022,5 January 2022,,
10,Location and staff all superb,"Location, staff and cleanliness",,United Kingdom,,1 night ·,Group,December 2021,31 December 2021,,
10,great hotel great staff 10/10,everything,nothing,United Kingdom,,1 night ·,Couple,November 2021,28 November 2021,,
10,Exceptional,location was oerfect,,United Kingdom,,2 nights ·,Couple,November 2021,18 November 2021,,
10,Superb hotel in a superb location,"Staff very friendly and extremely helpful.  Room was lovely and clean, with everything we needed.  Location was excellent for the West End and theatres",,United Kingdom,,1 night ·,Family,October 2021,30 October 2021,,
10,Lovely Stay!,The property is in the centre of it all and everything is in close distance! It was also a lovely place to stay and would happily stay there again! The staff were so lovely too!,,United Kingdom,,1 night ·,Family,October 2021,16 October 2021,,
5.0,In the middle of a great area - perfect location.,"Staff were lovely- polite and helpful, attended to our needs. Location is fantastic. Nice hotel.","Skimped on extras in room - no breakfast tea, biscuits, only 1 pair slippers. 2 day stay but no bed made, tidying, re stocking in between. Maybe it was because of Covid, so I understand if that was the case. Cleaners seemed lovely.",United Kingdom,,2 nights ·,Couple,October 2021,10 October 2021,,
6.0,Pleasant,Room upgrade and comfy bed,Cleaning outside rooms... DustyCould be improved.Breakfast area very poorLimited space open buffet poorly laid out questionable restrictions and surface protection of food.,United Kingdom,,1 night ·,Couple,October 2021,9 October 2021,,
4.0,Disappointing,"Staff were friendly, breakfast was good","Numerous problems with the room, not serviced, no gowns, one pair of slippers, no tea / coffee , broken lights, and this was supposedly an upgraded room , wanted a treat for my partner but so many things were not what you would expect from this sort of hotel !",United Kingdom,,1 night ·,Couple,September 2021,8 October 2021,,
4.0,Disappointing,The room was very clean. The elemis toiletries in the bathroom were nice. The reception staff were very friendly.,"The room was small and not at all luxurious for what I paid. I had to ring reception as there was only one cup and glass, as if the room was set up for one and not two. It was supposed to be a premier double but was disappointing. Breakfast was horrible. I hate to waste food but had to leave half of the cooked breakfast and looking around, so did everyone else in the dining room. There was also an electric cable trailing right across the floor in the buffet area which was dangerous. I don't know what star rating this hotel is but it was not great.",United Kingdom,,1 night ·,Group,October 2021,4 October 2021,,
10,First class Hotel.,Very warm welcome from reception staff. Upgrade on room very much appreciated. Everything was spotlessly clean and of high quality.,The breakfast seating has quite small capacity so expect to wait during busy periods. The quality of the food more than makes up for the wait. Excellent quality.,United Kingdom,,1 night ·,Couple,September 2021,22 September 2021,,
