score,title,likereview,dislikereview,country,rometype,intimelong,people,inrometime,reviewtime,help_vote,unhelp_vote
5.0,"Good location, room OK but nothing special",The rooms were comfortable. Our double room didn't have a bath though. Fairly friendly. Excellent location. But wouldn't stay here again. Plenty of better hotels at this price.,The Twin room had a see through bathroom not at all suitable. Cigarette ends left outside our window.The check in took 20mins. Bar and breakfast area not inviting. Poor breakfast. 2 star.,United Kingdom,Premier Twin Room,1 night ·,Family,December 2021,21 December 2021,,
5.0,not as special as we would have expected,proximity to centre/theatre/attractions,"some things missing not as advertised due to covid, but still charged same amount",United Kingdom,Club Double Room,3 nights ·,Couple,December 2021,20 December 2021,,
6.0,I have paid much less for much better hotels. in the main it was overpriced for the level of service,nice room even though the razor plug didn’t work and the mini bar wasempty.,eating place and bar were very poor.,United Kingdom,Premier Double Room,1 night ·,Couple,December 2021,20 December 2021,,
10,Nice hotel in an excellent location,superb location. I asked for a quiet room and the room I got was perfect… would have never known I was in a busy part of London!,Nothing negative to report.,United Kingdom,Premier Twin Room,1 night ·,Group,December 2021,19 December 2021,,
10,"brilliant, would recommend to anyone 👍🏽",reasonably priced for the area and the staff were boss!,N/A,United Kingdom,Premier Double Room,2 nights ·,Couple,December 2021,18 December 2021,,
10,Exceptional,the look of the place. the room/bathroom,,United Kingdom,Club Double Room,1 night ·,Couple,December 2021,18 December 2021,,
10,Best ever,"Excellent hotel. Clean, comfortable, attentive staff. Best hotel stay, ever. Perfect location.",Nothing to not like.,United Kingdom,Premier Twin Room,1 night ·,Couple,December 2021,17 December 2021,,
10,the staff were exceptional and went out of their way to ensure my disabled daughter and her Carer were comfortable and l,very comfortable beds,,United Kingdom,Premier Twin Room,1 night ·,Family,December 2021,16 December 2021,,
10,Fabulous location and Comfortable Beds,"We loved the location as we were here to visit Theatres. Staff were friendly, rooms were clean and bed very comfortable. Very good breakfast.We would stay here again.",Nothing to complain about. It was great.,United Kingdom,Premier Twin Room,1 night ·,Couple,December 2021,16 December 2021,,
6.0,Disappointed with dirty room,staff &amp; location,"Not clean.  Dirty sock in room, phlegm in sink plug, carpet not hoovered and surfaces hadn’t been wiped.  Missing Nespresso machine, cups, tea bags.  Was as if  someone made the bed, put towels in but forgot to replenish and clean.  Notified reception - housecleaning manager came to room promised would be rectified that day.  Still wasn’t had to ask again. When you pick 5star you expect to get a standard of cleaning and services.  Only 1/3 sockets worked.  Lamp bulb was broken.  Shaving mirror in bathroom was hanging loose.  Next 2 trips have booked elsewhere as especially during covid cleaning should be a basic service.",United Kingdom,Premier Single Room,2 nights ·,Solo traveller,December 2021,16 December 2021,,
10,Perfect location for West End theatres,Close to West End theatres. Staff were all really friendly and helpful. Room was upgraded for my daughter's birthday ... We didn't tell them they noticed the date themselves.,Nothing,United Kingdom,Premier Twin Room,1 night ·,Family,December 2021,16 December 2021,,
10,Excellent service,"Very clean room,  high standard,  fresh food",,United Kingdom,Premier Double Room,1 night ·,Couple,December 2021,14 December 2021,,
5.0,Great staff and location but needs a refurb,the staff and location,tired needs refurbishing. although booked a club room it was really small and pokey. only one small lift for the whole place. tiny breakfast room which is really the Indian restaurant. tasteless breakfast.,United Kingdom,Club Double Room,2 nights ·,Family,November 2021,14 December 2021,,
10,"Excellent hotel, wonderful staff.  Highly recommend.","Our room was clean, tidy and had all facilities needed.  We were greeted by very friendly staff and made to feel welcome straight away.  We were helped with any questions we had.  Our location was perfect for the theatre and Piccadilly.  Easy access to the underground.  We had a choice of breakfast which was excellent and had all our needs met.I would highly recommend this hotel and definitely would stay here again.","We liked everything about this hotel, staff, food and couldn't ask for any more.",United Kingdom,Premier Double Room,2 nights ·,Family,December 2021,14 December 2021,,
10,The staff are what make this hotel exceptional. Thank you for a wonderful stay.,"Absolutely loved the breakfast staff, such a friendly atmosphere and the food was delicious! We especially liked the Lady chef who was cooking, and the gentleman with the pony tail in the suit. Fantastic manners, very professional and a good quality to the hotel.",The windows didn't lock properly to shut out the outside noise.,United Kingdom,Premier Single Room,3 nights ·,Family,December 2021,13 December 2021,,
10,Amazing staff and location.,Amazing staff who made our weekend very special,nothing ... it was fab,United Kingdom,Club Double Room,1 night ·,Couple,December 2021,13 December 2021,,
6.0,Nice location but disappointing with the level service and attention to detail for the money,location,Very noisy at night- it sounded like a nightclub in our room.  Cramped breakfast location. Poor house keeping- our room wasn’t cleaned during the duration of our stay,United Kingdom,Premier Double Room,2 nights ·,Couple,December 2021,12 December 2021,,
10,great few days in the perfect location with staff that can’t do enough for you,location and staff,getting a little tired but the above makes up for it,United Kingdom,Club Double Room,2 nights ·,Couple,December 2021,10 December 2021,,
10,location very good. Near Chinatown. Had a really enjoyable stay. Thanks to all.,Bed was very comfortable. staff were very helpful and thoughtful. Breakfast was great.,,United Kingdom,Premier Double Room,3 nights ·,Couple,December 2021,9 December 2021,,
10,"modern, spacious and comfortable rooms. great location.","after staying two nights in a different hotel we decided to stay another night in London, booked The Piccadilly last minute and really wish we had stayed here longer, the room was really spacious, comfortable bed, convenient location, friendly, professional staff.",,United Kingdom,Premier Double Room,1 night ·,Couple,December 2021,7 December 2021,,
5.0,Location was good and the staff were friendly but I wouldn’t stay here again.,Location was really good and the staff were friendly.,We were put in to a disabled room and there was no bath as mentioned in the booking. We had one bath towel between us. We also had breakfast within our booking. Breakfast was until 10:45 but at no point were we told that we would have to wait. We never had our breakfast because we had to go. Breakfast should be bookable if they’re going to make you wait.,United Kingdom,Premier Double Room,1 night ·,Couple,December 2021,5 December 2021,,
10,"excellent location , very quiet considering it’s on Shaftesbury Avenue…lovely staff fabulous breakfast ..",great location nice staff comfy room .. breakfast was excellent …,need to check the crockery is clean.. Also the pillows could be a lot ..!!! softer or at least have one form one and a softer one …,United Kingdom,Premier Twin Room,1 night ·,Family,December 2021,4 December 2021,,
6.0,"locstion great, hotel not as great.",location,"room was tiny. bathroom was extremely tiny. room had a musty smell, ripped wallpaper and shower screen had lots of soap scum on it. would not have minded at all if this was a cheaper hotel but would have hoped for more in this one. location fantastic though.",United Kingdom,Premier Twin Room,2 nights ·,Couple,November 2021,4 December 2021,,
3.0,Poor,Location,The hotel is ridiculously run down. We expected quite a luxurious stay for the price we paid and we were really disappointed. If it wasn’t for the location we would have complained.,United Kingdom,Junior Suite,1 night ·,Family,November 2021,4 December 2021,,
10,Exceptional,Such a bargain for the location. Perfect for a London night out without having to stress about getting the last train!,,United Kingdom,Premier Double Room,1 night ·,Couple,December 2021,4 December 2021,,
10,Great Trip for the Theatre and Dinner all walkable,"3rd Visit and that is because of its LOCATION, VALUE, and most importantly CLEANILENESS",,United Kingdom,Premier Double Room,1 night ·,Couple,December 2021,3 December 2021,,
6.0,Great Location could use some work,"Comfy bed, friendly welcoming staff","Bathroom had 2 toe nails from someone else, hairs on bed and could hear loud bang from elevator everytime it was in use regardless of what floor it was on.",United Kingdom,Premier Double Room,1 night ·,Couple,December 2021,2 December 2021,,
3.0,Very disappointed and quite cross. Not worth what we paid.,the Location was excellent.The bed was comfortable.,"None of the staff cooking and serving breakfast wore masks. Breakfast served on cold plates. In the description of the hotel facilities,it’s says coffee shop on site. It also says bar and also restaurant. Extremely misleading information. The was the little cafe next door with a door from reception through to it. It was NOT a restaurant nor was it a bar. The hotel does not match the extremely misleading description regarding facilities. My 70th birthday treat was not what I was expecting.",United Kingdom,Premier Double Room,3 nights ·,Couple,December 2021,2 December 2021,,
10,we stayed overnight as we were seeing a show. it was a great location and would definitely stay there again.,perfect location. clean lovely English breakfast,I thought the room was supposed to have fresh fruit in but none there. only two teabags.,United Kingdom,Club Double Room,1 night ·,Family,November 2021,1 December 2021,,
10,Exceptional,"This is a lovely hotel which is next to China Tow and Leicester Square so handy for all of London Attractions, restaurants and Theatres. The staff were very helpful and very friendly. The breakfast was very good with a good selection for Continental or Full English.",Nothing liked it all,United Kingdom,Premier Double Room,2 nights ·,Couple,November 2021,30 November 2021,,
10,"perfect stay, great location, great value for money","perfect location, great breakfast and comfortable room",room was slightly cold even with heating on,United Kingdom,Premier Double Room,1 night ·,Couple,November 2021,29 November 2021,,
1.0,Dreadful. Thankfully the lovely staff managed to get us transferred to a partner hotel.,location,"tiny,dirty, noisy, dilapidated rooms",United Kingdom,Four-Poster Suite,3 nights ·,Couple,November 2021,29 November 2021,,
10,Family Celebration,Went for granddaughter 18 th received complimentary bottle of prosseco which was a lovely surprise. Found staff very nice and breakfast was very good tasty well cooked and plenty on offer.,Nothing really.,United Kingdom,Junior Suite,1 night ·,Family,November 2021,29 November 2021,,
1.0,Terrible customer service and a very unsatisfactory trip,,Room 205 backs on to a club and the music banged through the walls until 01:30 . I left the hotel exhausted the following morning. My husband I was was there for our anniversary and the experience ruined our weekend,United Kingdom,Premier Double Room,1 night ·,Couple,November 2021,28 November 2021,1,
4.0,"just a really poor experience overall, it was hugely overpriced for what we got, definitely wouldn’t stay there again","The curtains in the room were really good, kept it completely dark when sleeping. Concierge staff were very polite and helpful",Wasn’t very clean - room and bathroomrather than having a double bed we had two singles pushed togetherBreakfast was really poorRestaurant staff were very very rudeOverpriced,United Kingdom,Premier Double Room,1 night ·,Couple,November 2021,27 November 2021,,
10,fab,location and helpful staff,wouldn’t bother with the breakfast,United Kingdom,Premier Double Room,4 nights ·,Couple,November 2021,26 November 2021,,
4.0,Disappointing,Location,Toilet malfunction. Small double bed. More like a 3/4 bed. Left side of bed top half up against desk. Room tiny.,United Kingdom,Premier Double Room,1 night ·,Couple,November 2021,25 November 2021,,
10,comfortable in a good location,location is amazing for theatre trips,room was slightly small but adequate for one night,United Kingdom,Premier Twin Room,1 night ·,Family,November 2021,25 November 2021,,
10,excellent staff- perfect location - comfy bed !,fabulous staff - great room - excellent location,,United Kingdom,Club Double Room,1 night ·,Family,November 2021,24 November 2021,,
10,lovely stay,great location for the theatre and shopping,,United Kingdom,Premier Double Room,1 night ·,Family,October 2021,24 November 2021,,
5.0,"Adequate, more 3 star than 5 star!",location was good,Room not set up for 3 people.  Room not as clean as it could be.  Still waiting for reply from manager 3 days ago!,United Kingdom,Junior Suite,2 nights ·,Group,November 2021,22 November 2021,,
3.0,High expectations of 60th birthday treat for my wife were dashed by the appalling experience,"The hotel is in a great location. The room would have been very good but the housekeeping side of it was appalling. One of the saucers for the hot drinks was dirty and there was only one English breakfast teabag in the room for a two person occupancy. On arrival there was very little toilet paper in the toilet, which ran out after one trip to the loo. The bathrobes had no belts with them.  There was no internet for the whole of my stay and internet was one of my filters for choosing this hotel. The room was not cleaned after our first night in it. Breakfast at the hotel was very disorganised and was served lukewarm on both days. The breakfast room is very small and cannot cater for the number of guests. The management need to establish a booking system for breakfast so guests do not have to queue up in a very small reception area.The staff should be congratulated for their perseverence. At almost £300 per night this hotel does not live up to expectations - the management did not offer any refunds for the appalling service we experienced.","Just about everything.The room would have been very good but the housekeeping side of it was appalling. One of the saucers for the hot drinks was dirty and there was only one English breakfast teabag in the room for a two person occupancy. On arrival there was very little toilet paper in the toilet, which ran out after one trip to the loo. The bathrobes had no belts with them.  There was no internet for the whole of my stay and internet was one of my filters for choosing this hotel. The room was not cleaned after our first night in it. Breakfast at the hotel was very disorganised and was served lukewarm on both days. The breakfast room is very small and cannot cater for the number of guests. The management need to establish a booking system for breakfast so guests do not have to queue up in a very small reception area. At almost £300 per night this hotel does not live up to expectations - the management did not offer any refunds for the appalling service we experienced. A more realistic cost for the room would have been £100 but I imagine the location ensures a high charge. But management should not getaway with the appalling service",United Kingdom,Club Double Room,2 nights ·,Couple,November 2021,22 November 2021,,
10,Exceptional,"For a busy London Hotel we were made to feel so welcome and looked after. The hotel is busy for many reasons location, quality and service. All of which are the best I've experienced in a London hotel. Thankyou so much for an amazing stay!! We will be back 😊",Going home ☹,United Kingdom,Club Double Room,1 night ·,Couple,November 2021,22 November 2021,,
3.0,chaos &amp; over priced.. sorry to say was the worst hotel experience I’ve ever had,great location,The staff are unorganised &amp; hadnt a clue what was happening. Check in is a chaos . At Breakfast the staff hadn’t a clue what was going on. Seems to be no management advising staff what to do..This was the worst place I have ever been to &amp; im not lying. Would recommend.. The price for 1 night is terrible for the experience me &amp; my partner had…,United Kingdom,Premier Double Room,1 night ·,Couple,November 2021,22 November 2021,,
6.0,Staff ok but not that welcoming!,Great location. Clean rooms.,Lobby and breakfast area tiny. No Vegan breakfast options available.,United Kingdom,Premier Double Room,1 night ·,Couple,November 2021,21 November 2021,,
5.0,Passable,great location,Overly priced for what you get. We were told check-in was from 2pm but our rooms weren’t ready until 4pm.No toilet roll in the room.,United Kingdom,Club Double Room,1 night ·,Group,November 2021,21 November 2021,,
4.0,Average experience. Staff didn’t respond to requests around door security.,Good location for theatres.,"Room set up as double, despite requesting a twin (one adult and one child booking). Included Prosecco and two glasses in room despite booking including a child, so obviously inappropriate. Door locks didn’t work (didn’t need keys to open!) and weren’t fixed despite 3x requests.",United Kingdom,Premier Twin Room,1 night ·,Family,November 2021,21 November 2021,,
4.0,"Really lovely staff, facilities need to be updated and deeper cleaned.",location and lovely staff,"seemed a bit tired, not as clean as I would have liked",United Kingdom,Premier Double Room,1 night ·,Family,November 2021,20 November 2021,,
6.0,Pleasant,Location excellent for theatre.,Noise from traffic,United Kingdom,Premier Double Room,1 night ·,Couple,November 2021,19 November 2021,,
10,Exceptional,We were welcomed by very friendly staff.  They gave us an upgrade and the room was fab,,United Kingdom,Premier Double Room,1 night ·,Group,November 2021,18 November 2021,,
5.0,room too small for two people,very clean and central,"room was small and bed was tiny.  more like a large single .   too close to window , struggled to get out of bed as so close and curtains draping the floor",United Kingdom,Premier Double Room,1 night ·,Couple,November 2021,18 November 2021,,
4.0,the only good thing about this ridiculous hotel is the location &amp; the staff were lovely. but all the times I’ve stay,location,no bar breakfast room the size of a matchbox tiny reception.the que for breakfast was ridiculous .A 10 table matchbox for a hotel with400 + rooms .I’ve had better in a 2 star !!!!!!,United Kingdom,Premier Twin Room,3 nights ·,Couple,November 2021,17 November 2021,,
2.0,5 star more like 2,We were in a club room bed was comfortable but that is far it gose,No internet. no extras in room which we paid for 5 star hotel more like 2Suna not in use Gym not in use I did expect more for what we got and paid for i recommend if you looking a 5 star hotel dont go thereHotel needs a big upgrade,United Kingdom,Club Double Room,2 nights ·,Couple,November 2021,17 November 2021,,
4.0,"Not comfortable, dirty shower, noisy can't sleep. But good location !","Location is excellent, across Rd from china town, walking distance to the squares and regent st.","Hotel corridor full of laundry, cleaners making noise outside my room early hours of the morning. Dirty shower.",United Kingdom,Premier Double Room,1 night ·,Solo traveller,November 2021,17 November 2021,1,
5.0,"mixed feelings, but would not return or recommend",good facilities in the room,"poor quality breakfast, cramped and  small restaurant, waited 20 minutes for a table The most worrying aspect of the hotel was the cleaner and cleaning manager helping themselves to my daughters perfume, when reported to reception where the cleaning manager was present the receptionist apologised but the cleaning manager said nothing. A poor outcome and worrying for future visitors",United Kingdom,Junior Suite,2 nights ·,Family,November 2021,15 November 2021,,
5.0,Expected better for the pr8ce,Lovely breakfast,Room very smallMusty smell in bathroomPeeling wallpaper,United Kingdom,Premier Twin Room,1 night ·,Family,November 2021,15 November 2021,,
6.0,"good location, reasonable price - watch out for the noise","location was great, staff were helpful.","our room was not perfectly clean, we found a used slipper underneath the bed. a bit of noise from the street but the location made up for that. breakfast was disappointing as the room was cramped and we had to wait a while.",United Kingdom,Premier Double Room,2 nights ·,Couple,November 2021,14 November 2021,,
6.0,"Great location, but not a great sleep.",The location is spot on. Good breakfast and nice staff.,"Bed was tiny, small double, and pillows were hard. Room was noisy, must have been a generator or something outside.",United Kingdom,Premier Double Room,1 night ·,Couple,November 2021,14 November 2021,,
10,Exceptional,The Crew &amp; TheLocation,Nothing,Israel,Premier Twin Room,3 nights ·,Group,November 2021,13 November 2021,,
10,Superb location and fabulous hotel,"location is amazing, everything you could possibly want is within walking distance, saves having to get a cab and the tube station is very close by. It can be noisy in the evenings but that’s expected with the location and didn’t stop us from getting a good nights sleep. the hotel is clean and comfortable and worth every penny. The hotel certainly is a little gem hidden amongst the most fabulous west end theatres!",everything was simply fabulous!,United Kingdom,Premier Double Room,1 night ·,Couple,November 2021,12 November 2021,,
4.0,"perfect position, but oh . lacking good management. We booked breakfast and attended once. so bad never again.dirty kitc",position,"reception .front of house good. but the room ,poor. quality poor.",United Kingdom,Premier Double Room,3 nights ·,Couple,November 2021,11 November 2021,,
10,Exceptional,lovely hotel very clean,location,United Kingdom,Premier Double Room,1 night ·,Couple,November 2021,11 November 2021,,
10,Exceptional,"Huge comfy bed, lovely clean room and the breakfast was really good too.",,United Kingdom,Premier Double Room,1 night ·,Couple,November 2021,8 November 2021,,
1.0,"Great Hotel, Disappointing staff",The room was clean and tidy and a good location,"The staff was not very helpful what so ever, Accidentally left a pair of expensive jeans there and email to ask them to post them and I was happy to cover the cost. I had a email back saying that they would ask house keeping and get back to me. No one got back to me and still no jeans. I cant believe a hotel as nice as it is gets let down by such poor service!",United Kingdom,Premier Twin Room,1 night ·,Group,October 2021,8 November 2021,,
6.0,Pleasant,"Location, comfy bed and grateful for the upgrade. Nice shower and products and good breakfast.","Dead roses in the room. No bar, only one cup to have tea in with 2 adults. No teaspoons, no coffee pods but a coffee machine???Lights over 4 poster mist didn’t work. Hotel felt dated.",United Kingdom,Premier Double Room,1 night ·,Couple,November 2021,7 November 2021,,
10,10 out of 10,"Excellent location, great value and lovely staff.",Nothing,United Kingdom,Premier Double Room,1 night ·,Couple,November 2021,7 November 2021,,
3.0,It was certainly an experience.,The staff in the resturant went above and beyond they were so pleasent &amp; couldn't of been more helpful.The location was perfect.,"I explained when booking our night away on the special requests section that it was a suprise for my partners 40th birthday &amp; the fact he had never been to London before. The staff proceeded to asked us upon arrival what we were doing in London &amp; if it was an occasion ect it put me on spot as my partner was standing beside me &amp; he felt awkward as he could see me feeling awkward too. One receptionist was new so being being shown what to do, it took a bit of time to book us in, I know everyone has to start somewhere but it was all very awkward &amp; made us feel a bit uncomfortable. I also asked for a drink to be in the room when we got there for a suprise but it wasn't there. There was no food menu in room &amp; the telephone didn't work. There box of tissues in the room were damp, making the room smell musty.When getting back from our night out there were 3 drunk men &amp; a drunk women trying to use the hoteltoilet, she was extremely rude saying she was going to urinate on the steps if she wasn't allowed in. Security never moved them on? They all continued to argue while we waited for the lift &amp; then we went to our room, not a very nice experience to end our night.",United Kingdom,Premier Double Room,1 night ·,Couple,November 2021,7 November 2021,,
10,Exceptional,location and breakfast,nothing,United Kingdom,Premier Double Room,1 night ·,Couple,November 2021,7 November 2021,,
